{
  "schema_version": 1,
  "market": "CN_STOCK",
  "calendar_date": "2026-08-03",
  "is_trading_day": true,
  "session_kind": "FULL",
  "sessions": [{"start": "09:30", "end": "11:30"}, {"start": "13:00", "end": "15:00"}],
  "source": {"provider": "tushare", "retrieved_at": "2026-08-05T09:00:00+08:00"}
}
